{
  "schema_version": "0.1.0",
  "id": "rcpt_20260623_171551_fa5a69",
  "created_at": "2026-06-23T17:15:51.427Z",
  "updated_at": "2026-06-23T17:15:51.469Z",
  "status": "self-verified",
  "claim": {
    "summary": "Bump Receipts CI actions to v5",
    "details": "Updated GitHub Actions workflow from actions/checkout@v4 and actions/setup-node@v4 to v5 to address the Node 20 action-runtime deprecation annotation."
  },
  "actor": {
    "type": "agent",
    "id": "nori",
    "model": "sakana/fugu"
  },
  "task": {
    "source": "manual",
    "id": null,
    "url": null
  },
  "workspace": {
    "git_available": true,
    "repo": "/Users/beauxwalton/projects/receipts",
    "branch": "master",
    "commit_before": "45ef603a40e84601e0bf406bb407141842a4d640",
    "commit_after": "45ef603a40e84601e0bf406bb407141842a4d640",
    "git_status": "M .github/workflows/ci.yml\n M .receipts/active.json\n?? .receipts/receipts/rcpt_20260623_171551_fa5a69.draft.json",
    "git_diff_artifact": ".receipts/artifacts/rcpt_20260623_171551_fa5a69/git.diff"
  },
  "changes": [
    {
      "path": ".github/workflows/ci.yml",
      "kind": "modified",
      "summary": "M .github/workflows/ci.yml"
    },
    {
      "path": ".receipts/active.json",
      "kind": "modified",
      "summary": "M .receipts/active.json"
    }
  ],
  "evidence": [
    {
      "id": "ev_001",
      "kind": "command",
      "label": "Local CI contract",
      "created_at": "2026-06-23T17:15:51.448Z",
      "command": "npm run lint && npm test && npm run build",
      "exit_code": 0,
      "note": "Syntax lint, OpenSpec/unit/smoke tests, and npm pack dry-run build passed after bumping GitHub Actions to v5."
    },
    {
      "id": "ev_002",
      "kind": "git-diff",
      "label": "Git diff at receipt completion",
      "path": ".receipts/artifacts/rcpt_20260623_171551_fa5a69/git.diff",
      "created_at": "2026-06-23T17:15:51.511Z"
    }
  ],
  "verification": {
    "summary": "1 passed",
    "checks": [
      {
        "kind": "command",
        "label": "Local CI contract",
        "status": "passed",
        "evidence_id": "ev_001",
        "command": "npm run lint && npm test && npm run build",
        "exit_code": 0
      }
    ]
  },
  "risk": {
    "level": "medium",
    "notes": [
      "No known risks were identified. Review is still recommended."
    ],
    "assumptions": [],
    "rollback": null
  },
  "integrations": {},
  "recommended_next_action": "Push and confirm the GitHub Actions run passes without the old Node 20 action-runtime annotation.",
  "completed_at": "2026-06-23T17:15:51.469Z",
  "policy": {
    "verdict": "self-verified",
    "requested": "self-verified",
    "self_verified_allowed": true,
    "enforced": true,
    "reasons": [
      "all verification checks passed"
    ]
  },
  "integrity": {
    "algorithm": "sha256",
    "receipt_payload_sha256": "df5f8b44fcc6919c988784f58757cd81ecb4c930aa1ae7ed4b8349fbcb54338c",
    "artifacts": [
      {
        "path": ".receipts/artifacts/rcpt_20260623_171551_fa5a69/git.diff",
        "sha256": "85a893fbd379a3aa02ea2f1d295180986e0065d7f8cd4c63fa254349e9bf0745"
      }
    ]
  }
}
