{
  "schema_version": "0.1.0",
  "id": "rcpt_20260623_111623_77cc59",
  "created_at": "2026-06-23T11:16:23.589Z",
  "updated_at": "2026-06-23T11:16:24.872Z",
  "status": "draft",
  "claim": {
    "summary": "Implement Receipts v0 CLI (tasks 6.1-6.11)",
    "details": "Built local-first Node.js CLI with zero runtime deps: init, claim, evidence add, run, done. Emits JSON + Markdown receipts, captures command output as evidence, and collects git workspace metadata/diff. Added smoke test wired into npm test, updated README and OpenSpec tasks, and dogfooded Receipts on itself."
  },
  "actor": {
    "type": "agent",
    "id": "nori",
    "model": "sakana/fugu"
  },
  "task": {
    "source": "openclaw",
    "id": null,
    "url": null
  },
  "workspace": {},
  "changes": [],
  "evidence": [
    {
      "id": "ev_001",
      "kind": "command",
      "label": "npm test",
      "command": "npm test",
      "exit_code": 0,
      "stdout": ".receipts/artifacts/rcpt_20260623_111623_77cc59/command-001.stdout.log",
      "stderr": ".receipts/artifacts/rcpt_20260623_111623_77cc59/command-001.stderr.log",
      "created_at": "2026-06-23T11:16:24.851Z"
    },
    {
      "id": "ev_002",
      "kind": "note",
      "label": "npm test result",
      "created_at": "2026-06-23T11:16:24.872Z",
      "note": "OpenSpec validation + CLI smoke test both pass via npm test."
    }
  ],
  "verification": {
    "summary": "1 passed",
    "checks": [
      {
        "kind": "command",
        "label": "npm test",
        "status": "passed",
        "evidence_id": "ev_001",
        "command": "npm test",
        "exit_code": 0
      }
    ]
  },
  "risk": {
    "level": "unknown",
    "notes": [],
    "assumptions": [],
    "rollback": null
  },
  "integrations": {},
  "recommended_next_action": "Review the receipt and supporting evidence."
}
