{
  "schema_version": "0.1.0",
  "id": "rcpt_20260623_111623_77cc59",
  "created_at": "2026-06-23T11:16:23.589Z",
  "updated_at": "2026-06-23T11:16:24.894Z",
  "status": "needs-review",
  "claim": {
    "summary": "Implement Receipts v0 CLI (tasks 6.1-6.11)",
    "details": "Built local-first Node.js CLI with zero runtime deps: init, claim, evidence add, run, done. Emits JSON + Markdown receipts, captures command output as evidence, and collects git workspace metadata/diff. Added smoke test wired into npm test, updated README and OpenSpec tasks, and dogfooded Receipts on itself."
  },
  "actor": {
    "type": "agent",
    "id": "nori",
    "model": "sakana/fugu"
  },
  "task": {
    "source": "openclaw",
    "id": null,
    "url": null
  },
  "workspace": {
    "git_available": true,
    "repo": "/Users/beauxwalton/projects/receipts",
    "branch": "master",
    "commit_before": "edce8b58371245f89cbbe36621e34bc2651cde22",
    "commit_after": "edce8b58371245f89cbbe36621e34bc2651cde22",
    "git_status": "M README.md\n M openspec/changes/define-receipts-v0/tasks.md\n M package-lock.json\n M package.json\n?? .receipts/\n?? bin/\n?? test/",
    "git_diff_artifact": ".receipts/artifacts/rcpt_20260623_111623_77cc59/git.diff"
  },
  "changes": [
    {
      "path": "README.md",
      "kind": "modified",
      "summary": "M README.md"
    },
    {
      "path": "openspec/changes/define-receipts-v0/tasks.md",
      "kind": "modified",
      "summary": "M openspec/changes/define-receipts-v0/tasks.md"
    },
    {
      "path": "package-lock.json",
      "kind": "modified",
      "summary": "M package-lock.json"
    },
    {
      "path": "package.json",
      "kind": "modified",
      "summary": "M package.json"
    },
    {
      "path": ".receipts/",
      "kind": "added",
      "summary": "?? .receipts/"
    },
    {
      "path": "bin/",
      "kind": "added",
      "summary": "?? bin/"
    },
    {
      "path": "test/",
      "kind": "added",
      "summary": "?? test/"
    }
  ],
  "evidence": [
    {
      "id": "ev_001",
      "kind": "command",
      "label": "npm test",
      "command": "npm test",
      "exit_code": 0,
      "stdout": ".receipts/artifacts/rcpt_20260623_111623_77cc59/command-001.stdout.log",
      "stderr": ".receipts/artifacts/rcpt_20260623_111623_77cc59/command-001.stderr.log",
      "created_at": "2026-06-23T11:16:24.851Z"
    },
    {
      "id": "ev_002",
      "kind": "note",
      "label": "npm test result",
      "created_at": "2026-06-23T11:16:24.872Z",
      "note": "OpenSpec validation + CLI smoke test both pass via npm test."
    },
    {
      "id": "ev_003",
      "kind": "git-diff",
      "label": "Git diff at receipt completion",
      "path": ".receipts/artifacts/rcpt_20260623_111623_77cc59/git.diff",
      "created_at": "2026-06-23T11:16:24.937Z"
    }
  ],
  "verification": {
    "summary": "1 passed; 2 not run",
    "checks": [
      {
        "kind": "command",
        "label": "npm test",
        "status": "passed",
        "evidence_id": "ev_001",
        "command": "npm test",
        "exit_code": 0
      },
      {
        "kind": "manual",
        "label": "Cross-platform shell quoting edge cases",
        "status": "not-run",
        "explanation": "Recorded during receipt completion."
      },
      {
        "kind": "manual",
        "label": "GitHub/OpenClaw integration adapters",
        "status": "not-run",
        "explanation": "Recorded during receipt completion."
      }
    ]
  },
  "risk": {
    "level": "medium",
    "notes": [
      "No unit-level tests yet beyond the CLI smoke flow; modules not yet extracted."
    ],
    "assumptions": [],
    "rollback": null
  },
  "integrations": {},
  "recommended_next_action": "Review CLI, then extract schema/renderer modules and add the GitHub PR comment adapter (tasks 7.x).",
  "completed_at": "2026-06-23T11:16:24.894Z"
}
